{
  "goal_proposal_version": "0.1",
  "proposal_id": "goal-proposal-cc95a5756727dbd5",
  "created_at": "2026-08-15T14:46:00Z",
  "proposer": {
    "actor": "rcl-demo",
    "organization": "RCL demo community"
  },
  "proposed_goal": {
    "goal_id": "safety.verify_sitting_area_clear",
    "summary": "Verify that the intended sitting area is clear before committing to a sitting motion.",
    "semantics": "The robot establishes sufficient evidence that the intended sitting region is clear before sitting proceeds, while leaving sensing and body strategy to the target embodiment.",
    "triggers": [
      "activity.before_sit_down"
    ],
    "success_conditions": [
      "state.sitting_area_clear"
    ],
    "allowed_failure_actions": [
      "block",
      "retry",
      "request_help",
      "abort"
    ]
  },
  "source_extension_goal_ids": [
    "x.acme.verify_sitting_area_clear"
  ],
  "portability_rationale": "This proposal attempts to standardize an already familiar portable safety purpose across different embodiments.",
  "evidence_refs": [
    "proposal://demo/duplicate-sitting-goal"
  ]
}
